{
  "id": "laravel-model",
  "category": "backend",
  "name": "laravel",
  "spec_type": "model",
  "title": "Eloquent Model",
  "description": "Laravel Eloquent model with fillable, casts, and relationships",
  "content": "<?php\n\nnamespace App\\Models;\n\nuse Illuminate\\Database\\Eloquent\\Factories\\HasFactory;\nuse Illuminate\\Database\\Eloquent\\Model;\nuse Illuminate\\Database\\Eloquent\\Relations\\{RelationType};\nuse Illuminate\\Database\\Eloquent\\SoftDeletes;\n\nclass {ModelName} extends Model\n{\n    use HasFactory, SoftDeletes;\n\n    protected $fillable = [\n        'field1',\n        'field2',\n        'field3',\n    ];\n\n    protected $casts = [\n        'field1' => 'string',\n        'field2' => 'integer',\n        'is_active' => 'boolean',\n        'created_at' => 'datetime',\n        'updated_at' => 'datetime',\n    ];\n\n    protected $hidden = [\n        'password',\n        'remember_token',\n    ];\n\n    // Relationships\n    public function relatedModel(): {RelationType}\n    {\n        return $this->{relation}(RelatedModel::class);\n    }\n}",
  "language": "php",
  "framework_version": null,
  "ignore_patterns": [
    "vendor/*",
    "node_modules/*"
  ],
  "file_extensions": [
    "php"
  ],
  "is_active": true,
  "metadata": {
    "created_at": "2025-12-29T09:58:45.175651Z",
    "updated_at": "2025-12-29T09:58:45.175652Z"
  }
}