{
  "id": "laravel-seeder",
  "category": "backend",
  "name": "laravel",
  "spec_type": "seeder",
  "title": "Database Seeder",
  "description": "Laravel seeder for populating database",
  "content": "<?php\n\nnamespace Database\\Seeders;\n\nuse App\\Models\\{ModelName};\nuse Illuminate\\Database\\Seeder;\n\nclass {ModelName}Seeder extends Seeder\n{\n    public function run(): void\n    {\n        // Create specific records\n        {ModelName}::create([\n            'name' => 'Default Item',\n            'description' => 'Default description',\n            'is_active' => true,\n        ]);\n\n        // Create random records using factory\n        {ModelName}::factory()\n            ->count(50)\n            ->create();\n\n        // Create with relationships\n        {ModelName}::factory()\n            ->count(10)\n            ->hasRelated(3)\n            ->create();\n    }\n}",
  "language": "php",
  "framework_version": null,
  "ignore_patterns": [
    "vendor/*"
  ],
  "file_extensions": [
    "php"
  ],
  "is_active": true,
  "metadata": {
    "created_at": "2025-12-29T09:58:45.175663Z",
    "updated_at": "2025-12-29T09:58:45.175663Z"
  }
}