{
  "id": "laravel-config",
  "category": "backend",
  "name": "laravel",
  "spec_type": "config",
  "title": "Configuration File",
  "description": "Laravel configuration file",
  "content": "<?php\n\nreturn [\n    /*\n    |--------------------------------------------------------------------------\n    | {Configuration Name}\n    |--------------------------------------------------------------------------\n    |\n    | Configuration description here\n    |\n    */\n\n    'key' => env('CONFIG_KEY', 'default_value'),\n\n    'nested' => [\n        'option1' => env('OPTION1', true),\n        'option2' => env('OPTION2', 'value'),\n    ],\n\n    'array_options' => [\n        'item1',\n        'item2',\n        'item3',\n    ],\n];",
  "language": "php",
  "framework_version": null,
  "ignore_patterns": [
    "vendor/*"
  ],
  "file_extensions": [
    "php"
  ],
  "is_active": true,
  "metadata": {
    "created_at": "2025-12-29T09:58:45.175666Z",
    "updated_at": "2025-12-29T09:58:45.175666Z"
  }
}