{
  "id": "nextjs-hook",
  "category": "frontend",
  "name": "nextjs",
  "spec_type": "hook",
  "title": "Custom React Hook",
  "description": "Reusable React hook",
  "content": "'use client'\n\nimport { useState, useEffect, useCallback } from 'react'\n\ninterface UseDataOptions {\n  initialData?: any\n  autoFetch?: boolean\n}\n\ninterface UseDataReturn {\n  data: any\n  isLoading: boolean\n  error: Error | null\n  refetch: () => Promise<void>\n  mutate: (newData: any) => void\n}\n\nexport function useData(\n  url: string,\n  options: UseDataOptions = {}\n): UseDataReturn {\n  const { initialData = null, autoFetch = true } = options\n\n  const [data, setData] = useState(initialData)\n  const [isLoading, setIsLoading] = useState(false)\n  const [error, setError] = useState<Error | null>(null)\n\n  const fetchData = useCallback(async () => {\n    setIsLoading(true)\n    setError(null)\n\n    try {\n      const response = await fetch(url)\n      if (!response.ok) {\n        throw new Error(`HTTP error! status: ${response.status}`)\n      }\n      const result = await response.json()\n      setData(result)\n    } catch (err) {\n      setError(err as Error)\n    } finally {\n      setIsLoading(false)\n    }\n  }, [url])\n\n  const mutate = useCallback((newData: any) => {\n    setData(newData)\n  }, [])\n\n  useEffect(() => {\n    if (autoFetch) {\n      fetchData()\n    }\n  }, [autoFetch, fetchData])\n\n  return {\n    data,\n    isLoading,\n    error,\n    refetch: fetchData,\n    mutate,\n  }\n}",
  "language": "typescript",
  "framework_version": null,
  "ignore_patterns": [
    "node_modules/*",
    ".next/*"
  ],
  "file_extensions": [
    "ts"
  ],
  "is_active": true,
  "metadata": {
    "created_at": "2025-12-29T10:00:32.556884Z",
    "updated_at": "2025-12-29T10:00:32.556884Z"
  }
}