{
  "id": "laravel-migration",
  "category": "backend",
  "name": "laravel",
  "spec_type": "migration",
  "title": "Database Migration",
  "description": "Laravel migration with proper column types and indexes",
  "content": "<?php\n\nuse Illuminate\\Database\\Migrations\\Migration;\nuse Illuminate\\Database\\Schema\\Blueprint;\nuse Illuminate\\Support\\Facades\\Schema;\n\nreturn new class extends Migration\n{\n    public function up(): void\n    {\n        Schema::create('{table_name}', function (Blueprint $table) {\n            $table->id();\n            $table->string('name');\n            $table->text('description')->nullable();\n            $table->boolean('is_active')->default(true);\n            $table->foreignId('user_id')->constrained()->onDelete('cascade');\n            $table->timestamps();\n            $table->softDeletes();\n\n            // Indexes\n            $table->index('name');\n            $table->index(['user_id', 'is_active']);\n        });\n    }\n\n    public function down(): void\n    {\n        Schema::dropIfExists('{table_name}');\n    }\n};",
  "language": "php",
  "framework_version": null,
  "ignore_patterns": [
    "vendor/*"
  ],
  "file_extensions": [
    "php"
  ],
  "is_active": true,
  "metadata": {
    "created_at": "2025-12-29T09:58:45.175652Z",
    "updated_at": "2025-12-29T09:58:45.175653Z"
  }
}