{
  "id": "laravel-request",
  "category": "backend",
  "name": "laravel",
  "spec_type": "request",
  "title": "Form Request Validation",
  "description": "Laravel form request with validation rules and authorization",
  "content": "<?php\n\nnamespace App\\Http\\Requests;\n\nuse Illuminate\\Foundation\\Http\\FormRequest;\nuse Illuminate\\Validation\\Rule;\n\nclass {ModelName}Request extends FormRequest\n{\n    public function authorize(): bool\n    {\n        return true; // Implement your authorization logic\n    }\n\n    public function rules(): array\n    {\n        return [\n            'name' => ['required', 'string', 'max:255'],\n            'email' => ['required', 'email', Rule::unique('users')->ignore($this->user)],\n            'description' => ['nullable', 'string'],\n            'is_active' => ['boolean'],\n            'category_id' => ['required', 'exists:categories,id'],\n        ];\n    }\n\n    public function messages(): array\n    {\n        return [\n            'name.required' => 'The name field is required.',\n            'email.unique' => 'This email is already taken.',\n        ];\n    }\n}",
  "language": "php",
  "framework_version": null,
  "ignore_patterns": [
    "vendor/*"
  ],
  "file_extensions": [
    "php"
  ],
  "is_active": true,
  "metadata": {
    "created_at": "2025-12-29T09:58:45.175655Z",
    "updated_at": "2025-12-29T09:58:45.175655Z"
  }
}