{
  "id": "nextjs-server_component",
  "category": "frontend",
  "name": "nextjs",
  "spec_type": "server_component",
  "title": "Server Component",
  "description": "Next.js Server Component with data fetching",
  "content": "import { Suspense } from 'react'\nimport { Skeleton } from '@/components/ui/skeleton'\n\ninterface ComponentProps {\n  id: string\n}\n\nasync function getData(id: string) {\n  const res = await fetch(`${process.env.API_URL}/api/data/${id}`, {\n    next: { revalidate: 3600 }, // Cache for 1 hour\n  })\n\n  if (!res.ok) {\n    throw new Error('Failed to fetch data')\n  }\n\n  return res.json()\n}\n\nexport default async function ServerComponent({ id }: ComponentProps) {\n  const data = await getData(id)\n\n  return (\n    <div className=\"space-y-4\">\n      <h2 className=\"text-2xl font-semibold\">{data.title}</h2>\n      <p className=\"text-muted-foreground\">{data.description}</p>\n\n      <Suspense fallback={<Skeleton className=\"h-64 w-full\" />}>\n        <NestedComponent data={data.nested} />\n      </Suspense>\n    </div>\n  )\n}\n\nasync function NestedComponent({ data }: { data: any }) {\n  // Parallel data fetching in nested component\n  return <div>{/* Nested content */}</div>\n}",
  "language": "typescript",
  "framework_version": null,
  "ignore_patterns": [
    "node_modules/*",
    ".next/*"
  ],
  "file_extensions": [
    "tsx"
  ],
  "is_active": true,
  "metadata": {
    "created_at": "2025-12-29T10:00:32.556878Z",
    "updated_at": "2025-12-29T10:00:32.556879Z"
  }
}