{
  "id": "laravel-event",
  "category": "backend",
  "name": "laravel",
  "spec_type": "event",
  "title": "Event",
  "description": "Laravel event for broadcasting and listeners",
  "content": "<?php\n\nnamespace App\\Events;\n\nuse App\\Models\\{ModelName};\nuse Illuminate\\Broadcasting\\Channel;\nuse Illuminate\\Broadcasting\\InteractsWithSockets;\nuse Illuminate\\Broadcasting\\PresenceChannel;\nuse Illuminate\\Contracts\\Broadcasting\\ShouldBroadcast;\nuse Illuminate\\Foundation\\Events\\Dispatchable;\nuse Illuminate\\Queue\\SerializesModels;\n\nclass {EventName} implements ShouldBroadcast\n{\n    use Dispatchable, InteractsWithSockets, SerializesModels;\n\n    public function __construct(\n        public readonly {ModelName} ${model},\n    ) {}\n\n    public function broadcastOn(): array\n    {\n        return [\n            new Channel('{channel-name}'),\n            new PresenceChannel('presence-{channel}'),\n        ];\n    }\n\n    public function broadcastAs(): string\n    {\n        return '{event.name}';\n    }\n\n    public function broadcastWith(): array\n    {\n        return [\n            'id' => $this->{model}->id,\n            'name' => $this->{model}->name,\n        ];\n    }\n}",
  "language": "php",
  "framework_version": null,
  "ignore_patterns": [
    "vendor/*"
  ],
  "file_extensions": [
    "php"
  ],
  "is_active": true,
  "metadata": {
    "created_at": "2025-12-29T09:58:45.175658Z",
    "updated_at": "2025-12-29T09:58:45.175659Z"
  }
}