{
  "id": "nextjs-page",
  "category": "frontend",
  "name": "nextjs",
  "spec_type": "page",
  "title": "App Router Page",
  "description": "Next.js 14 App Router page component with metadata",
  "content": "import { Metadata } from 'next'\n\nexport const metadata: Metadata = {\n  title: '{Page Title}',\n  description: '{Page Description}',\n}\n\ninterface PageProps {\n  params: { slug: string }\n  searchParams: { [key: string]: string | string[] | undefined }\n}\n\nexport default async function Page({ params, searchParams }: PageProps) {\n  // Server-side data fetching\n  const data = await fetch(`${process.env.API_URL}/api/data/${params.slug}`)\n  const result = await data.json()\n\n  return (\n    <div className=\"container mx-auto py-8\">\n      <h1 className=\"text-3xl font-bold mb-6\">{result.title}</h1>\n      <div className=\"prose max-w-none\">\n        {/* Content */}\n      </div>\n    </div>\n  )\n}",
  "language": "typescript",
  "framework_version": null,
  "ignore_patterns": [
    "node_modules/*",
    ".next/*",
    "out/*"
  ],
  "file_extensions": [
    "tsx",
    "ts"
  ],
  "is_active": true,
  "metadata": {
    "created_at": "2025-12-29T10:00:32.556870Z",
    "updated_at": "2025-12-29T10:00:32.556873Z"
  }
}