{
  "id": "laravel-listener",
  "category": "backend",
  "name": "laravel",
  "spec_type": "listener",
  "title": "Event Listener",
  "description": "Laravel event listener for handling events",
  "content": "<?php\n\nnamespace App\\Listeners;\n\nuse App\\Events\\{EventName};\nuse Illuminate\\Contracts\\Queue\\ShouldQueue;\nuse Illuminate\\Queue\\InteractsWithQueue;\nuse Illuminate\\Support\\Facades\\Log;\n\nclass {ListenerName} implements ShouldQueue\n{\n    use InteractsWithQueue;\n\n    public function __construct()\n    {\n        //\n    }\n\n    public function handle({EventName} $event): void\n    {\n        Log::info('Handling event', [\n            'event' => get_class($event),\n            'data' => $event->{model}->toArray(),\n        ]);\n\n        // Listener logic here\n    }\n\n    public function failed({EventName} $event, \\Throwable $exception): void\n    {\n        Log::error(\"Listener failed: {$exception->getMessage()}\");\n    }\n}",
  "language": "php",
  "framework_version": null,
  "ignore_patterns": [
    "vendor/*"
  ],
  "file_extensions": [
    "php"
  ],
  "is_active": true,
  "metadata": {
    "created_at": "2025-12-29T09:58:45.175659Z",
    "updated_at": "2025-12-29T09:58:45.175659Z"
  }
}