{
  "id": "tailwind-layout",
  "category": "css",
  "name": "tailwind",
  "spec_type": "layout",
  "title": "Layout Pattern",
  "description": "Common layout patterns with Tailwind",
  "content": "{/* Grid Layout */}\n<div className=\"container mx-auto px-4\">\n  <div className=\"grid grid-cols-1 md:grid-cols-2 lg:grid-cols-3 gap-6\">\n    {items.map(item => (\n      <div key={item.id} className=\"bg-white rounded-lg p-6 shadow\">\n        {/* Card content */}\n      </div>\n    ))}\n  </div>\n</div>\n\n{/* Flexbox Layout */}\n<div className=\"flex flex-col min-h-screen\">\n  <header className=\"sticky top-0 z-50 bg-white border-b\">\n    {/* Header */}\n  </header>\n  <main className=\"flex-1 container mx-auto px-4 py-8\">\n    {/* Main content */}\n  </main>\n  <footer className=\"bg-gray-50 border-t mt-auto\">\n    {/* Footer */}\n  </footer>\n</div>",
  "language": "jsx",
  "framework_version": null,
  "ignore_patterns": [
    "node_modules/*"
  ],
  "file_extensions": [
    "jsx",
    "tsx"
  ],
  "is_active": true,
  "metadata": {
    "created_at": "2025-12-29T10:01:26.983001Z",
    "updated_at": "2025-12-29T10:01:26.983002Z"
  }
}