{
  "id": "postgresql-function",
  "category": "database",
  "name": "postgresql",
  "spec_type": "function",
  "title": "Function/Procedure",
  "description": "PostgreSQL function with logic",
  "content": "CREATE OR REPLACE FUNCTION update_updated_at_column()\nRETURNS TRIGGER AS $$\nBEGIN\n  NEW.updated_at = CURRENT_TIMESTAMP;\n  RETURN NEW;\nEND;\n$$ LANGUAGE plpgsql;\n\nCREATE TRIGGER update_users_updated_at\n  BEFORE UPDATE ON users\n  FOR EACH ROW\n  EXECUTE FUNCTION update_updated_at_column();",
  "language": "sql",
  "framework_version": null,
  "ignore_patterns": [],
  "file_extensions": [
    "sql"
  ],
  "is_active": true,
  "metadata": {
    "created_at": "2025-12-29T10:01:26.982996Z",
    "updated_at": "2025-12-29T10:01:26.982997Z"
  }
}