{
  "id": "postgresql-table",
  "category": "database",
  "name": "postgresql",
  "spec_type": "table",
  "title": "Table Creation",
  "description": "PostgreSQL table with constraints and indexes",
  "content": "CREATE TABLE users (\n  id UUID PRIMARY KEY DEFAULT gen_random_uuid(),\n  email VARCHAR(255) UNIQUE NOT NULL,\n  name VARCHAR(255) NOT NULL,\n  password_hash VARCHAR(255) NOT NULL,\n  is_active BOOLEAN DEFAULT true,\n  created_at TIMESTAMP WITH TIME ZONE DEFAULT CURRENT_TIMESTAMP,\n  updated_at TIMESTAMP WITH TIME ZONE DEFAULT CURRENT_TIMESTAMP\n);\n\nCREATE INDEX idx_users_email ON users(email);\nCREATE INDEX idx_users_active ON users(is_active) WHERE is_active = true;",
  "language": "sql",
  "framework_version": null,
  "ignore_patterns": [],
  "file_extensions": [
    "sql"
  ],
  "is_active": true,
  "metadata": {
    "created_at": "2025-12-29T10:01:26.982987Z",
    "updated_at": "2025-12-29T10:01:26.982991Z"
  }
}