{
  "id": "laravel-blade_view",
  "category": "backend",
  "name": "laravel",
  "spec_type": "blade_view",
  "title": "Blade Template",
  "description": "Laravel Blade view template",
  "content": "@extends('layouts.app')\n\n@section('title', '{Page Title}')\n\n@section('content')\n<div class=\"container\">\n    <div class=\"row\">\n        <div class=\"col-md-12\">\n            <h1>{{ ${title} }}</h1>\n\n            @if(session('success'))\n                <div class=\"alert alert-success\">\n                    {{ session('success') }}\n                </div>\n            @endif\n\n            <div class=\"card\">\n                <div class=\"card-header\">\n                    <h2>{{ ${heading} }}</h2>\n                </div>\n                <div class=\"card-body\">\n                    @forelse(${items} as ${item})\n                        <div class=\"item\">\n                            <h3>{{ ${item}->name }}</h3>\n                            <p>{{ ${item}->description }}</p>\n\n                            @can('update', ${item})\n                                <a href=\"{{ route('{resource}.edit', ${item}) }}\" class=\"btn btn-primary\">\n                                    Edit\n                                </a>\n                            @endcan\n                        </div>\n                    @empty\n                        <p>No items found.</p>\n                    @endforelse\n\n                    {{ ${items}->links() }}\n                </div>\n            </div>\n        </div>\n    </div>\n</div>\n@endsection",
  "language": "blade",
  "framework_version": null,
  "ignore_patterns": [
    "vendor/*",
    "node_modules/*"
  ],
  "file_extensions": [
    "blade.php"
  ],
  "is_active": true,
  "metadata": {
    "created_at": "2025-12-29T09:58:45.175665Z",
    "updated_at": "2025-12-29T09:58:45.175665Z"
  }
}