{
  "id": "nextjs-types",
  "category": "frontend",
  "name": "nextjs",
  "spec_type": "types",
  "title": "TypeScript Type Definitions",
  "description": "TypeScript interfaces and types",
  "content": "/**\n * Base entity interface\n */\nexport interface BaseEntity {\n  id: string\n  createdAt: Date\n  updatedAt: Date\n}\n\n/**\n * API response wrapper\n */\nexport interface ApiResponse<T> {\n  data: T\n  message?: string\n  error?: string\n}\n\n/**\n * Paginated response\n */\nexport interface PaginatedResponse<T> {\n  data: T[]\n  pagination: {\n    page: number\n    limit: number\n    total: number\n    totalPages: number\n  }\n}\n\n/**\n * Form field error\n */\nexport interface FieldError {\n  field: string\n  message: string\n}\n\n/**\n * Form state\n */\nexport interface FormState {\n  errors?: FieldError[]\n  message?: string\n  success?: boolean\n}\n\n/**\n * User type\n */\nexport interface User extends BaseEntity {\n  name: string\n  email: string\n  image?: string\n  role: 'admin' | 'user'\n}\n\n/**\n * API error\n */\nexport class ApiError extends Error {\n  constructor(\n    message: string,\n    public statusCode: number,\n    public details?: any\n  ) {\n    super(message)\n    this.name = 'ApiError'\n  }\n}",
  "language": "typescript",
  "framework_version": null,
  "ignore_patterns": [
    "node_modules/*",
    ".next/*"
  ],
  "file_extensions": [
    "ts"
  ],
  "is_active": true,
  "metadata": {
    "created_at": "2025-12-29T10:00:32.556885Z",
    "updated_at": "2025-12-29T10:00:32.556886Z"
  }
}