{
  "id": "laravel-resource",
  "category": "backend",
  "name": "laravel",
  "spec_type": "resource",
  "title": "API Resource",
  "description": "Laravel API resource for transforming models to JSON",
  "content": "<?php\n\nnamespace App\\Http\\Resources;\n\nuse Illuminate\\Http\\Request;\nuse Illuminate\\Http\\Resources\\Json\\JsonResource;\n\nclass {ModelName}Resource extends JsonResource\n{\n    public function toArray(Request $request): array\n    {\n        return [\n            'id' => $this->id,\n            'name' => $this->name,\n            'description' => $this->description,\n            'is_active' => $this->is_active,\n            'created_at' => $this->created_at?->toISOString(),\n            'updated_at' => $this->updated_at?->toISOString(),\n\n            // Relationships (conditional loading)\n            'related' => RelatedResource::collection($this->whenLoaded('related')),\n        ];\n    }\n}",
  "language": "php",
  "framework_version": null,
  "ignore_patterns": [
    "vendor/*"
  ],
  "file_extensions": [
    "php"
  ],
  "is_active": true,
  "metadata": {
    "created_at": "2025-12-29T09:58:45.175656Z",
    "updated_at": "2025-12-29T09:58:45.175656Z"
  }
}