{
  "id": "laravel-controller",
  "category": "backend",
  "name": "laravel",
  "spec_type": "controller",
  "title": "Controller Structure",
  "description": "Laravel controller with proper dependency injection and resource methods",
  "content": "<?php\n\nnamespace App\\Http\\Controllers;\n\nuse App\\Models\\{ModelName};\nuse App\\Http\\Requests\\{ModelName}Request;\nuse Illuminate\\Http\\JsonResponse;\nuse Illuminate\\Http\\Request;\n\nclass {ModelName}Controller extends Controller\n{\n    public function index(): JsonResponse\n    {\n        ${items} = {ModelName}::paginate(15);\n        return response()->json(${items});\n    }\n\n    public function store({ModelName}Request $request): JsonResponse\n    {\n        ${item} = {ModelName}::create($request->validated());\n        return response()->json(${item}, 201);\n    }\n\n    public function show({ModelName} ${item}): JsonResponse\n    {\n        return response()->json(${item});\n    }\n\n    public function update({ModelName}Request $request, {ModelName} ${item}): JsonResponse\n    {\n        ${item}->update($request->validated());\n        return response()->json(${item});\n    }\n\n    public function destroy({ModelName} ${item}): JsonResponse\n    {\n        ${item}->delete();\n        return response()->json(null, 204);\n    }\n}",
  "language": "php",
  "framework_version": null,
  "ignore_patterns": [
    "vendor/*",
    "node_modules/*",
    "storage/*",
    "bootstrap/cache/*"
  ],
  "file_extensions": [
    "php"
  ],
  "is_active": true,
  "metadata": {
    "created_at": "2025-12-29T09:58:45.175647Z",
    "updated_at": "2025-12-29T09:58:45.175649Z"
  }
}