{
  "id": "laravel-routes_api",
  "category": "backend",
  "name": "laravel",
  "spec_type": "routes_api",
  "title": "API Routes",
  "description": "Laravel API routes with resource controllers and middleware",
  "content": "<?php\n\nuse App\\Http\\Controllers\\{ControllerName};\nuse Illuminate\\Support\\Facades\\Route;\n\nRoute::middleware('auth:sanctum')->group(function () {\n    Route::apiResource('{resources}', {ControllerName}::class);\n\n    // Custom routes\n    Route::post('{resources}/{id}/custom-action', [{ControllerName}::class, 'customAction']);\n});\n\n// Public routes\nRoute::get('{resources}/public', [{ControllerName}::class, 'publicIndex']);",
  "language": "php",
  "framework_version": null,
  "ignore_patterns": [
    "vendor/*"
  ],
  "file_extensions": [
    "php"
  ],
  "is_active": true,
  "metadata": {
    "created_at": "2025-12-29T09:58:45.175653Z",
    "updated_at": "2025-12-29T09:58:45.175654Z"
  }
}