{
  "id": "nextjs-env",
  "category": "frontend",
  "name": "nextjs",
  "spec_type": "env",
  "title": "Environment Variables Types",
  "description": "TypeScript types for environment variables",
  "content": "namespace NodeJS {\n  interface ProcessEnv {\n    // App\n    NEXT_PUBLIC_APP_URL: string\n    NEXT_PUBLIC_APP_NAME: string\n\n    // API\n    NEXT_PUBLIC_API_URL: string\n    API_SECRET_KEY: string\n\n    // Database\n    DATABASE_URL: string\n\n    // Authentication\n    NEXTAUTH_URL: string\n    NEXTAUTH_SECRET: string\n    GITHUB_ID: string\n    GITHUB_SECRET: string\n\n    // Third-party services\n    STRIPE_SECRET_KEY: string\n    STRIPE_WEBHOOK_SECRET: string\n\n    // Analytics\n    NEXT_PUBLIC_GA_ID: string\n\n    // Feature flags\n    NEXT_PUBLIC_ENABLE_ANALYTICS: string\n  }\n}\n\nexport {}",
  "language": "typescript",
  "framework_version": null,
  "ignore_patterns": [
    "node_modules/*",
    ".next/*"
  ],
  "file_extensions": [
    "d.ts"
  ],
  "is_active": true,
  "metadata": {
    "created_at": "2025-12-29T10:00:32.556887Z",
    "updated_at": "2025-12-29T10:00:32.556887Z"
  }
}