{
  "id": "laravel-notification",
  "category": "backend",
  "name": "laravel",
  "spec_type": "notification",
  "title": "Notification",
  "description": "Laravel notification for multi-channel notifications",
  "content": "<?php\n\nnamespace App\\Notifications;\n\nuse Illuminate\\Bus\\Queueable;\nuse Illuminate\\Contracts\\Queue\\ShouldQueue;\nuse Illuminate\\Notifications\\Messages\\MailMessage;\nuse Illuminate\\Notifications\\Notification;\n\nclass {NotificationName} extends Notification implements ShouldQueue\n{\n    use Queueable;\n\n    public function __construct(\n        public readonly string $title,\n        public readonly string $message,\n    ) {}\n\n    public function via(object $notifiable): array\n    {\n        return ['mail', 'database'];\n    }\n\n    public function toMail(object $notifiable): MailMessage\n    {\n        return (new MailMessage)\n            ->subject($this->title)\n            ->line($this->message)\n            ->action('View Details', url('/'))\n            ->line('Thank you for using our application!');\n    }\n\n    public function toArray(object $notifiable): array\n    {\n        return [\n            'title' => $this->title,\n            'message' => $this->message,\n        ];\n    }\n}",
  "language": "php",
  "framework_version": null,
  "ignore_patterns": [
    "vendor/*"
  ],
  "file_extensions": [
    "php"
  ],
  "is_active": true,
  "metadata": {
    "created_at": "2025-12-29T09:58:45.175660Z",
    "updated_at": "2025-12-29T09:58:45.175660Z"
  }
}